{
  "logging": {
    "enablePerformanceLogging": false,
    "level": "Information",
    "logDirectory": "/home/alexj/repos/forker/tests/TestData/temp/logs",
    "maxLogSizeMB": 10,
    "fileLogging": false,
    "eventLogSource": "FileCopierTest",
    "logRetentionDays": 7
  },
  "copying": {
    "retryDelaySeconds": [
      1,
      2
    ],
    "preserveTimestamps": true,
    "verifyAfterCopy": true,
    "maxConcurrentCopies": 2,
    "chunkSizeBytes": 65536,
    "maxRetries": 15
  },
  "monitoring": {
    "excludeExtensions": [
      ".tmp",
      ".temp"
    ],
    "includeSubdirectories": false,
    "fileFilters": [
      "*.svs",
      "*.txt"
    ],
    "stabilityCheckInterval": 1,
    "minimumFileAge": 1,
    "maxStabilityChecks": 3
  },
  "service": {
    "healthCheckIntervalMinutes": 1,
    "shutdownTimeoutSeconds": 10,
    "enableHotConfigReload": true,
    "pollingIntervalSeconds": 1,
    "maxProcessingQueueSize": 100
  },
  "directories": {
    "error": "/home/alexj/repos/forker/tests/TestData/error",
    "processing": "/home/alexj/repos/forker/tests/TestData/processing",
    "targetA": "/home/alexj/repos/forker/tests/TestData/targetA",
    "targetB": "/home/alexj/repos/forker/tests/TestData/targetB",
    "source": "invalid-path-format"
  },
  "verification": {
    "hashAlgorithm": "SHA256",
    "fallbackToSizeCheck": true,
    "retryDelaySeconds": 1,
    "method": "hash",
    "streamingHashChunkSize": 4096,
    "maxRetries": 2
  }
}
